{
  "cost_usd": 0.1709056,
  "duration_ms": 32749,
  "effort": null,
  "is_error": false,
  "iteration": 22,
  "model": "sonnet",
  "models_used": {
    "claude-sonnet-5-5": {
      "cache_creation_input_tokens": 22492,
      "cache_read_input_tokens": 217328,
      "cost_usd": 0.1709056,
      "input_tokens": 16,
      "output_tokens": 3744
    }
  },
  "permission_denials": [],
  "phase": "review",
  "run_id": "B20261005-0933-quality-pass",
  "schema": "session/v1",
  "started": "2026-10-06T08:33:02Z",
  "task": "T15",
  "turns": 9
}
