{
  "cost_usd": 0.28585019999999994,
  "duration_ms": 111753,
  "effort": null,
  "ended": "2026-10-15T17:41:33Z",
  "is_error": false,
  "iteration": 11,
  "model": "sonnet",
  "models_used": {
    "claude-sonnet-5-5": {
      "cache_creation_input_tokens": 38710,
      "cache_read_input_tokens": 592602,
      "cost_usd": 0.28585019999999994,
      "input_tokens": 30,
      "output_tokens": 7169
    }
  },
  "permission_denials": [
    {
      "command": "cd ~/source/personal/vloop; gofmt -l tools; go vet ./tools/... \u0026\u0026 go test ./tools/... 2\u003e\u00261|tail -5\nc=$(mktemp -d); git clone -q . $c/self; cd $c/self; git checkout -q main 2\u003e\u00261; git -C . status -sb | …",
      "tool_name": "Bash"
    },
    {
      "command": "c=$(mktemp -d) \u0026\u0026 git clone -q ~/source/personal/vloop \"$c/self\" \u0026\u0026 git -C \"$c/self\" checkout -q main \u0026\u0026 echo \"$c\" \u0026\u0026 git -C \"$c/self\" tag | tail -3 \u0026\u0026 git -C \"$c/self\" status -sb | head -2",
      "tool_name": "Bash"
    },
    {
      "command": "mkdir -p .vloop/tmp/rd \u0026\u0026 git clone -q . .vloop/tmp/rd/self \u0026\u0026 git -C .vloop/tmp/rd/self checkout -q main \u0026\u0026 git -C .vloop/tmp/rd/self status -sb | head -2",
      "tool_name": "Bash"
    }
  ],
  "phase": "work",
  "run_id": "B20261015-1651-b17-release",
  "schema": "session/v1",
  "started": "2026-10-15T17:39:40Z",
  "task": "T9",
  "turns": 16,
  "wall_ms": 112719
}
