{
  "cost_usd": 0.20089759999999998,
  "duration_ms": 58417,
  "effort": null,
  "is_error": false,
  "iteration": 19,
  "model": "sonnet",
  "models_used": {
    "claude-sonnet-5-5": {
      "cache_creation_input_tokens": 28526,
      "cache_read_input_tokens": 248658,
      "cost_usd": 0.20089759999999998,
      "input_tokens": 16,
      "output_tokens": 3703
    }
  },
  "permission_denials": [],
  "phase": "work",
  "run_id": "B20261003-2049-gate-model",
  "schema": "session/v1",
  "started": "2026-10-04T01:14:28Z",
  "task": "T15",
  "turns": 9
}
