{
  "cost_usd": 0.1337898,
  "duration_ms": 27331,
  "effort": null,
  "is_error": false,
  "iteration": 16,
  "model": "sonnet",
  "models_used": {
    "claude-sonnet-5-5": {
      "input_tokens": 14,
      "output_tokens": 2227,
      "cache_read_input_tokens": 175959,
      "cache_creation_input_tokens": 19075,
      "cost_usd": 0.1337898
    }
  },
  "permission_denials": [],
  "phase": "work",
  "run_id": "B20261002-2135-vloop-v1-security",
  "schema": "session/v1",
  "started": "2026-10-03T00:01:40Z",
  "task": "T14",
  "turns": 7
}
