{
  "cost_usd": 0.9289340000000001,
  "duration_ms": 667095,
  "effort": null,
  "is_error": false,
  "iteration": 7,
  "model": "sonnet",
  "models_used": {
    "claude-sonnet-5-5": {
      "input_tokens": 60,
      "output_tokens": 21771,
      "cache_read_input_tokens": 1953460,
      "cache_creation_input_tokens": 80103,
      "cost_usd": 0.9289340000000001
    }
  },
  "permission_denials": [
    {
      "tool_name": "Bash",
      "tool_use_id": "toolu_01Gr4Jk447zSpgsyfG11MRDy",
      "tool_input": {
        "command": "d=$(mktemp -d); git archive HEAD | tar -x -C $d; cd $d \u0026\u0026 go test ./cmd/... -run 'TestWorkedExampleEnglishSession|TestRun03GateRegression|TestRun41RegressionNamesBoth' 2\u003e\u00261 | grep -E \"^(--- FAIL|FAIL|ok)\"; rm -rf $d",
        "timeout": 400000
      }
    }
  ],
  "phase": "work",
  "run_id": "B20261002-2135-vloop-v1-security",
  "schema": "session/v1",
  "started": "2026-10-02T22:43:17Z",
  "task": "T7",
  "turns": 33
}
