{
  "cost_usd": 0.1173778,
  "duration_ms": 26724,
  "effort": null,
  "ended": "2026-10-11T23:46:43Z",
  "is_error": false,
  "iteration": 2,
  "model": "sonnet",
  "models_used": {
    "claude-sonnet-5-5": {
      "cache_creation_input_tokens": 17228,
      "cache_read_input_tokens": 164578,
      "cost_usd": 0.1173778,
      "input_tokens": 14,
      "output_tokens": 3198
    }
  },
  "permission_denials": [
    {
      "command": "grep -rn '\"claude\"\\|Args(' --include=*.go internal cmd | grep -v _test | head -20; claude --help 2\u003e\u00261 | grep -n append-system-prompt; cat .vloop/tmp/proposal.json | head -40; git status --short .vloop…",
      "tool_name": "Bash"
    },
    {
      "command": "claude --help 2\u003e\u00261 | grep -n append-system-prompt",
      "tool_name": "Bash"
    }
  ],
  "phase": "review",
  "run_id": "B20261011-2251-b14-learning-loop",
  "schema": "session/v1",
  "started": "2026-10-11T23:46:15Z",
  "task": "T2",
  "turns": 10,
  "wall_ms": 27709
}
