{
  "cost_usd": 3.7651035999999998,
  "duration_ms": 1005375,
  "effort": null,
  "ended": "2026-10-25T11:02:48Z",
  "is_error": false,
  "iteration": 0,
  "model": "opus",
  "models_used": {
    "claude-opus-5-5": {
      "cache_creation_input_tokens": 146602,
      "cache_read_input_tokens": 5755918,
      "cost_usd": 3.7651035999999998,
      "input_tokens": 116,
      "output_tokens": 72032
    }
  },
  "permission_denials": [
    {
      "command": "vloop metrics --help 2\u003e\u00261 | head -30; vloop brief close --help 2\u003e\u00261 | head -30",
      "tool_name": "Bash"
    },
    {
      "command": "vloop brief close --help 2\u003e\u00261 | sed -n 1,40p",
      "tool_name": "Bash"
    },
    {
      "command": "d=$(mktemp -d) \u0026\u0026 cd $d \u0026\u0026 git init -q \u0026\u0026 HOME=$d vloop init \u003e/dev/null 2\u003e\u00261; ls -la .vloop; cat .vloop/repo-guidelines.md | head; rm -rf $d",
      "tool_name": "Bash"
    },
    {
      "command": "w=$(cat /tmp/simdir); cd \"$w/c\" \u0026\u0026 git checkout -q . \u0026\u0026 git clean -qfd \u0026\u0026 python3 - \u003c\u003c'EOF'\ns=open('internal/config/config.go').read()\nold='\t{Name: \"effort.verify\", Valid: efforts},\\n'\nadd=''.join('\t{…",
      "tool_name": "Bash"
    },
    {
      "command": "w=$(cat /tmp/simdir); rm -rf \"$w\" /tmp/proto*.sh /tmp/before /tmp/simdir; echo cleaned",
      "tool_name": "Bash"
    }
  ],
  "phase": "plan",
  "run_id": "B20261025-0930-b18-agent-per-phase",
  "schema": "session/v1",
  "started": "2026-10-25T10:46:01Z",
  "turns": 59,
  "wall_ms": 1006249
}
