{
  "cost_usd": 0.1452859,
  "duration_ms": 63259,
  "effort": null,
  "ended": "2026-10-14T16:02:33Z",
  "is_error": false,
  "iteration": 17,
  "model": "sonnet",
  "models_used": {
    "claude-sonnet-5-5": {
      "cache_creation_input_tokens": 24380,
      "cache_read_input_tokens": 235639,
      "cost_usd": 0.1452859,
      "input_tokens": 16,
      "output_tokens": 2417
    }
  },
  "permission_denials": [
    {
      "command": "git stash -q 2\u003e/dev/null; true; git stash pop -q; vloop metrics --json | jq -r '.[]|select(.status==\"consumed\")|\"\\(.brief) \\(.defects.in_loop)/\\(.defects.operator)/\\(.defects.escaped)\"'; git log --one…",
      "tool_name": "Bash"
    }
  ],
  "phase": "work",
  "run_id": "B20261014-1138-b15-code-health-escapes",
  "schema": "session/v1",
  "started": "2026-10-14T16:01:29Z",
  "task": "T10",
  "turns": 9,
  "wall_ms": 64315
}
