{
  "cost_usd": 0.22894000000000003,
  "duration_ms": 500519,
  "effort": null,
  "is_error": false,
  "iteration": 8,
  "model": "sonnet",
  "models_used": {
    "claude-sonnet-5-5": {
      "input_tokens": 28,
      "output_tokens": 4167,
      "cache_read_input_tokens": 400110,
      "cache_creation_input_tokens": 26798,
      "cost_usd": 0.22894000000000003
    }
  },
  "permission_denials": [
    {
      "tool_name": "Bash",
      "tool_use_id": "toolu_01UBu4wVU3zs18ttXgDiLCpN",
      "tool_input": {
        "command": "go test -count=1 ./cmd/vloop 2\u003e\u00261 | grep -v '^ok' | head -40; git stash list | head -1",
        "timeout": 600000
      }
    }
  ],
  "phase": "review",
  "run_id": "B20261002-2135-vloop-v1-security",
  "schema": "session/v1",
  "started": "2026-10-02T23:04:35Z",
  "task": "T7",
  "turns": 14
}
